{
  "schema_version": "1.0.0",
  "deliverable_id": "RES-STUDY-TRACE-LANDSCAPE-001",
  "validation_id": "VAL-READY-008",
  "status": "informative-draft",
  "researched_at": "2026-08-21",
  "methodology": [
    "Treat transport bytes, semantic projection, unknown-field behavior, and transformation loss as separate questions.",
    "Prefer publisher specifications and documentation. Mark behavior not stated by those sources as not-specified rather than inferring compatibility.",
    "Use descriptions of harmless structural samples; this study does not redistribute provider payloads."
  ],
  "ecosystems": [
    {
      "id": "openai",
      "name": "OpenAI Responses API",
      "category": "provider-api",
      "version_or_date": "Responses streaming reference, accessed 2026-08-21",
      "transport": {
        "mode": "HTTPS request/response; streaming uses server-sent events",
        "raw_bytes": "conditional",
        "framing": "Named semantic events are delivered as SSE data",
        "capture_surface": "Client, reverse proxy, or SDK transport hook before parsing"
      },
      "projection": {
        "model": "Response objects and typed lifecycle/content delta events",
        "granularity": "Response, output item, content part, and delta",
        "semantic_mapping": "SDKs project SSE JSON into typed response events"
      },
      "unknown_fields": {
        "behavior": "not-specified",
        "scope": "The API reference does not promise that SDK parsing and reserialization retain future JSON members"
      },
      "lossiness": {
        "rating": "medium",
        "known_losses": ["Typed projections need not retain SSE delimiters, header order, JSON whitespace, or unmodeled members"]
      },
      "samples": [
        {
          "kind": "stream event",
          "shape": "response.output_text.delta event containing a delta and identifiers",
          "research_use": "Exercise the boundary between captured SSE bytes and the typed event projection"
        }
      ],
      "conclusions": ["A typed event stream is not proof of exact request or response byte retention."],
      "open_questions": ["Which official SDK versions preserve unrecognized event types and members?"],
      "limitations": ["Documentation describes protocol semantics, not every intermediary or SDK implementation."],
      "sources": [
        {
          "id": "TRACE-SRC-OPENAI-001",
          "publisher": "OpenAI",
          "title": "Streaming API responses",
          "version_or_date": "Current documentation, accessed 2026-08-21",
          "source_url": "https://platform.openai.com/docs/api-reference/responses-streaming",
          "accessed_at": "2026-08-21",
          "claim_supported": "The Responses API exposes typed streaming events including response and output-text lifecycle events."
        }
      ]
    },
    {
      "id": "anthropic",
      "name": "Anthropic Messages API",
      "category": "provider-api",
      "version_or_date": "Messages streaming reference, accessed 2026-08-21",
      "transport": {
        "mode": "HTTPS; streaming uses server-sent events",
        "raw_bytes": "conditional",
        "framing": "SSE events carry message, content-block, ping, and error event payloads",
        "capture_surface": "Client or gateway before the SDK combines content deltas"
      },
      "projection": {
        "model": "Message/content-block lifecycle with typed deltas",
        "granularity": "Message, content block, and delta",
        "semantic_mapping": "Events may be accumulated into a final Message object"
      },
      "unknown_fields": {
        "behavior": "not-specified",
        "scope": "Anthropic states clients should handle unknown event types gracefully; this is forward-compatible handling, not an exact-byte guarantee"
      },
      "lossiness": {
        "rating": "medium",
        "known_losses": ["Accumulating deltas loses original SSE framing and may lose unknown-event payloads depending on the client"]
      },
      "samples": [
        {
          "kind": "stream sequence",
          "shape": "message_start, content_block_delta, and message_stop SSE events",
          "research_use": "Compare event order and partial JSON deltas with a final projected message"
        }
      ],
      "conclusions": ["Unknown event tolerance does not imply that an SDK stores or re-emits unknown events."],
      "open_questions": ["Do all maintained SDK stream helpers expose raw unknown events to callers?"],
      "limitations": ["The source gives client guidance but does not specify intermediary retention."],
      "sources": [
        {
          "id": "TRACE-SRC-ANTHROPIC-001",
          "publisher": "Anthropic",
          "title": "Streaming Messages",
          "version_or_date": "Current documentation, accessed 2026-08-21",
          "source_url": "https://docs.anthropic.com/en/docs/build-with-claude/streaming",
          "accessed_at": "2026-08-21",
          "claim_supported": "Message streaming uses SSE, defines typed events and deltas, and instructs clients to handle unknown event types gracefully."
        }
      ]
    },
    {
      "id": "gemini",
      "name": "Google Gemini generateContent API",
      "category": "provider-api",
      "version_or_date": "Gemini API reference, accessed 2026-08-21",
      "transport": {
        "mode": "REST or RPC; streamGenerateContent supports an SSE mode",
        "raw_bytes": "conditional",
        "framing": "A stream of GenerateContentResponse values",
        "capture_surface": "HTTP/RPC client or gateway before SDK object conversion"
      },
      "projection": {
        "model": "Content, Part, Candidate, usage, citation, and safety objects",
        "granularity": "Candidate and content part per streamed response",
        "semantic_mapping": "SDKs project wire responses into language-specific response objects"
      },
      "unknown_fields": {
        "behavior": "not-specified",
        "scope": "The API reference does not guarantee retention of unknown JSON members by SDK objects"
      },
      "lossiness": {
        "rating": "medium",
        "known_losses": ["SDK aggregation can lose response chunk boundaries, serialization details, and future fields"]
      },
      "samples": [
        {
          "kind": "stream response",
          "shape": "GenerateContentResponse with candidate content parts and usage metadata",
          "research_use": "Test chunk-order capture separately from final candidate text"
        }
      ],
      "conclusions": ["Gemini semantic content objects should be linked to, not substituted for, transport capture."],
      "open_questions": ["How do current SDKs expose unknown Part variants and response fields?"],
      "limitations": ["REST, RPC, and SDK transports may produce different observable framing."],
      "sources": [
        {
          "id": "TRACE-SRC-GEMINI-001",
          "publisher": "Google",
          "title": "Gemini API: models.streamGenerateContent",
          "version_or_date": "Current API reference, accessed 2026-08-21",
          "source_url": "https://ai.google.dev/api/generate-content#method:-models.streamgeneratecontent",
          "accessed_at": "2026-08-21",
          "claim_supported": "The API streams GenerateContentResponse objects and documents SSE as a supported streaming response mode."
        }
      ]
    },
    {
      "id": "bedrock",
      "name": "Amazon Bedrock Runtime",
      "category": "provider-api",
      "version_or_date": "Runtime API reference, accessed 2026-08-21",
      "transport": {
        "mode": "HTTPS with AWS event-stream responses for streaming inference",
        "raw_bytes": "conditional",
        "framing": "Binary AWS event-stream frames contain model response chunks and exception events",
        "capture_surface": "SigV4-aware client or gateway before event-stream decoding"
      },
      "projection": {
        "model": "Provider-specific body inside Bedrock chunk and exception envelope types",
        "granularity": "Event-stream message and model chunk",
        "semantic_mapping": "SDK decodes the envelope; model body remains dependent on the selected model"
      },
      "unknown_fields": {
        "behavior": "not-specified",
        "scope": "The Runtime reference does not promise preservation of unknown provider body fields after model-specific decoding"
      },
      "lossiness": {
        "rating": "medium",
        "known_losses": ["A unified projection can erase AWS event headers, binary frame boundaries, and provider-specific payload members"]
      },
      "samples": [
        {
          "kind": "event-stream frame",
          "shape": "PayloadPart bytes or a modeled exception event",
          "research_use": "Retain envelope and payload boundaries before provider-specific parsing"
        }
      ],
      "conclusions": ["Bedrock has both an AWS envelope and a model-specific inner format; both layers matter."],
      "open_questions": ["Which managed gateways expose the original AWS event-stream headers and CRC-protected frames?"],
      "limitations": ["Model-specific bodies vary and cannot be treated as one Bedrock semantic schema."],
      "sources": [
        {
          "id": "TRACE-SRC-BEDROCK-001",
          "publisher": "Amazon Web Services",
          "title": "InvokeModelWithResponseStream",
          "version_or_date": "Current API reference, accessed 2026-08-21",
          "source_url": "https://docs.aws.amazon.com/bedrock/latest/APIReference/API_runtime_InvokeModelWithResponseStream.html",
          "accessed_at": "2026-08-21",
          "claim_supported": "Streaming model invocation returns an AWS event stream with payload-part and modeled exception events."
        }
      ]
    },
    {
      "id": "openai-compatible",
      "name": "OpenAI-compatible APIs",
      "category": "provider-api",
      "version_or_date": "TGI Messages API documentation, accessed 2026-08-21",
      "transport": {